{
  "$schema": "http://json-schema.org/draft-07/schema#",
  "title": "Create Account Form Schema",
  "type": "object",
  "properties": {
    "formName": {
      "type": "string"
    },
    "formLink": {
      "type": "string",
      "format": "uri"
    },
    "fields": {
      "type": "array",
      "items": {
        "type": "object",
        "properties": {
          "id": {
            "type": "string"
          },
          "type": {
            "type": "string"
          },
          "required": {
            "type": "boolean"
          },
          "regex": {
            "type": "string"
          }
        },
        "required": ["id", "type", "required"]
      }
    },
    "actions": {
      "type": "array",
      "items": {
        "type": "object",
        "properties": {
          "alias": {
            "type": "string"
          },
          "data-testid": {
            "type": "string"
          },
          "label": {
            "type": "string"
          },
          "defaultState": {
            "type": "string",
            "enum": ["enabled", "disabled"]
          }
        },
        "required": ["alias", "data-testid", "label", "defaultState"]
      }
    },
    "rules": {
      "type": "array",
      "items": {
        "type": "object",
        "properties": {
          "conditionType": {
            "type": "string",
            "enum": [
              "ALL_FIELDS_VALID",
              "ANY_FIELD_INVALID",
              "ANY_FIELD_EMPTY"
            ]
          },
          "fields": {
            "type": "array",
            "items": {
              "type": "string"
            }
          },
          "actionStates": {
            "type": "array",
            "items": {
              "type": "object",
              "properties": {
                "alias": {
                  "type": "string"
                },
                "state": {
                  "type": "string",
                  "enum": ["enabled", "disabled"]
                }
              },
              "required": ["alias", "state"]
            }
          }
        },
        "required": ["conditionType", "actionStates"]
      }
    }
  },
  "required": ["formName", "formLink", "fields", "actions", "rules"]
}
