{
  "formName": "Create Account",
  "formLink": "http://127.0.0.1:5500/cypress/formulaires/CreateAccount.html",
  "fields": [
    { "id": "firstName", "type": "input", "required": true, "regex": "^[A-Z][a-z]{1,50}$" }, 
    { "id": "lastName", "type": "input", "required": true, "regex": "^[A-Z][a-z]{1,50}$" }
  ],
  "actions": [
      { "alias": "submit", "data-testid": "create-account-btn", "label": "Créer un compte", "defaultState": "disabled" }
    , { "alias": "reset", "data-testid": "reset-btn", "label": "Réinitialiser", "defaultState": "disabled" }
  ],
  "rules": [
    {
      "conditionType": "ALL_FIELDS_VALID",
      "actionStates": [{"alias": "submit", "state": "enabled"},{"alias": "reset", "state": "enabled"}]},
    {
      "conditionType": "ANY_FIELD_INVALID",
      "fields": ["lastName","age", "email", "password"],
      "actionStates": [ {"alias": "submit", "state": "disabled"}, {"alias": "reset", "state": "enabled"} ] },
    {
      "conditionType": "ANY_FIELD_EMPTY",
      "fields": ["lastName","age","email", "password"],
      "actionStates": [ {"alias": "submit", "state": "disabled"}, {"alias": "reset", "state": "enabled"} ]}
  ]
}